{"run":24,"commit":"d82ebab","metric":0,"metrics":{"tests":76,"ts_files":28},"status":"crash","description":"Query decoding attempt failed typecheck due readonly-array narrowing","timestamp":1779045429460,"segment":0,"confidence":5.071428571428571,"asi":{"hypothesis":"Add small query parameter decoding with Effect Schema while deferring route params.","error_details":"tsc failed in queryFromRequest: TypeScript did not narrow QueryValue to string in the non-array branch because QueryValue includes ReadonlyArray<string>.","rollback_reason":"Typecheck failure; reverted per autoresearch rules.","next_action_hint":"Reapply using `const existingValues = typeof existing === 'string' ? [existing] : existing` or an explicit cast in the else branch."}}
{"run":25,"commit":"e49ebbf","metric":76,"metrics":{"tests":76,"ts_files":28},"status":"keep","description":"Add Effect Schema query parameter decoding helpers","timestamp":1779045478258,"segment":0,"confidence":5.241379310344827,"asi":{"hypothesis":"Typed query decoding is useful for Datastar resource endpoints and keeps routing explicit without introducing path params yet.","learned":"queryFromRequest can preserve normal params as strings and repeated params as arrays; readQuery composes that with Effect Schema, including NumberFromString parsing and typed schema failures. Avoid route params for now to keep router simple.","next_action_hint":"Next: add small route composition ergonomics (prefix or concat) rather than params. Prefixing supports grouping /api or /examples while staying exact-route and simple."}}
{"run":26,"commit":"e49ebbf","metric":0,"metrics":{"tests":79,"ts_files":29},"status":"crash","description":"Route composition helper attempt failed typecheck because concatRoutes widened route requirements to any","timestamp":1779045531493,"segment":0,"confidence":5.241379310344827,"asi":{"hypothesis":"Add prefix/concat route composition helpers while preserving exact-route semantics and avoiding path params.","error_details":"Tests failed typecheck: concatRoutes returned routes widened to Route<any, any>, making router return an Effect with any requirements that Effect.runPromise rejected under exactOptionalPropertyTypes.","rollback_reason":"Typecheck failure; reverted per autoresearch rules.","next_action_hint":"Reapply prefixRoutes only first, or type concatRoutes with a simpler generic that preserves each group element union without widening to any; alternatively use router(...health, ...api) and skip concatRoutes."}}
{"run":27,"commit":"ad99910","metric":78,"metrics":{"tests":78,"ts_files":29},"status":"keep","description":"Add exact-route prefixing helper for route group assembly","timestamp":1779045569304,"segment":0,"confidence":4.588235294117647,"asi":{"hypothesis":"Route prefixing is a small ergonomic win for grouping Datastar endpoints while preserving the explicit exact-route model.","learned":"prefixRoutes works without introducing path params, nested routers, or middleware. A broader concatRoutes helper widened route types to any and was discarded; route groups can be spread directly for now.","tradeoff":"This intentionally avoids dynamic params. Query decoding plus exact paths remains simpler and aligned with the exploratory scope.","next_action_hint":"Next potential DX improvement: typed HTML attribute merging could catch collisions or support conditional attrs, but be cautious not to over-abstract."}}
{"run":28,"commit":"ad99910","metric":0,"metrics":{"tests":82,"ts_files":30},"status":"crash","description":"Strict attribute merge tests failed because dataAttr string values are JSON string literals","timestamp":1779045626677,"segment":0,"confidence":4.588235294117647,"asi":{"hypothesis":"Offer strict attribute merging to catch accidental collisions while keeping permissive mergeAttrs for overrides.","error_details":"Only failing test expected dataAttr('disabled', '$saving') to emit $saving, but string inputs are intentionally JSON-quoted expressions. Need raw('$saving') or a Signal for Datastar expression values.","rollback_reason":"Test failure; reverted per autoresearch rules.","next_action_hint":"Reapply with raw('$saving') in the test for expression-valued dataAttr."}}
{"run":29,"commit":"30460fb","metric":82,"metrics":{"tests":82,"ts_files":30},"status":"keep","description":"Add strict attribute merging for collision-sensitive Datastar fragments","timestamp":1779045667801,"segment":0,"confidence":4.96969696969697,"asi":{"hypothesis":"Attribute collision detection is useful when composing many Datastar attr fragments; a strict merge helper can catch mistakes without removing the permissive override merge.","learned":"mergeAttrs remains override-friendly, while mergeAttrsStrict throws AttributeConflictError on duplicate keys and works for independent Datastar fragments. Tests should use raw('$saving') or Signal values for Datastar expressions; plain strings are intentionally JSON string literals.","next_action_hint":"Next useful iteration: add docs/examples for choosing builder vs JSX and strict vs permissive attrs, or add more expression DSL helpers such as conditional/and/or to reduce raw JavaScript strings."}}
{"run":30,"commit":"db235d1","metric":87,"metrics":{"tests":87,"ts_files":31},"status":"keep","description":"Add minimal Datastar expression combinators","timestamp":1779045724701,"segment":0,"confidence":4.833333333333333,"asi":{"hypothesis":"Small expression combinators can improve type-safe Datastar DX without turning the prototype into a full expression language.","learned":"not/and/or/ternary cover common conditional attribute/text use cases and compose cleanly with Signal, raw, dataClass, dataAttr, and text. Empty and/or use logical identities to keep generated expressions predictable.","tradeoff":"This stays intentionally tiny; no method-chain string/array DSL yet. Further expression work should be motivated by examples, not completeness.","next_action_hint":"Add a fuller example using query decoding + direct responses or realtime helper, to validate primitives compose beyond the counter."}}
{"run":31,"commit":"34f3993","metric":92,"metrics":{"tests":92,"ts_files":32},"status":"keep","description":"Add search example with dynamic Datastar URL, query decoding, and direct HTML patches","timestamp":1779045820944,"segment":0,"confidence":4.842105263157895,"asi":{"hypothesis":"A second vertical example will validate that the primitives compose beyond a counter and reveal whether direct HTML patch responses feel coherent.","learned":"Dynamic URL expressions fit naturally by allowing get/post/etc. to accept Expr<string>. The search example composes dataSignals, bind, debounced data-on, readQuery, htmlPatchResponse, and exact routes without adding new framework abstractions. This demonstrates a non-SSE single-shot Datastar action path.","tradeoff":"The dynamic URL still uses raw template literal JavaScript; a safer URL builder may be worth exploring later if examples repeat this pattern.","next_action_hint":"Potential next step: a typed URL/query expression helper for dynamic action URLs, or a live example using Broadcaster to prove realtime composition in an example file."}}
{"run":32,"commit":"4bbea89","metric":96,"metrics":{"tests":96,"ts_files":33},"status":"keep","description":"Add encoded queryUrl helper for dynamic Datastar action URLs","timestamp":1779045912355,"segment":0,"confidence":5.052631578947368,"asi":{"hypothesis":"A small URL expression helper can remove raw JavaScript template literals from common dynamic @get URLs while preserving explicit Datastar expressions.","learned":"queryUrl composes with signal refs and static values to produce encoded template-literal URLs, and get/post/etc. can accept Expr<string> URLs. The search example now uses queryUrl instead of raw URL JavaScript.","tradeoff":"queryUrl does not handle optional/removable params yet; it intentionally covers the common stable-query case only.","next_action_hint":"A live realtime example using Broadcaster would validate the remaining realtime primitives in examples, but avoid expanding into a sync engine."}}
{"run":33,"commit":"4bbea89","metric":0,"metrics":{"tests":100,"ts_files":35},"status":"crash","description":"Live counter example failed typecheck due Handler namespace/type export collision","timestamp":1779045995489,"segment":0,"confidence":5.052631578947368,"asi":{"hypothesis":"A live counter example can validate Broadcaster + liveElementsResponse realtime composition without introducing a sync engine.","error_details":"examples/live-counter.ts imported `type Handler` from index, but index also exports `Handler` namespace, causing TS2709 Cannot use namespace 'Handler' as a type. Downstream test values became unknown.","rollback_reason":"Typecheck failure; reverted per autoresearch rules.","next_action_hint":"Reapply importing `type Handler` directly from `../src/handler.js`, not from index."}}
{"run":34,"commit":"256b106","metric":100,"metrics":{"tests":100,"ts_files":34},"status":"keep","description":"Add live counter example backed by Broadcaster SSE patches","timestamp":1779046056403,"segment":0,"confidence":5,"asi":{"hypothesis":"A live example should prove the realtime primitives compose into a Datastar CQRS-style flow without adding a sync engine.","learned":"createLiveCounter demonstrates page init opening /live, POST /increment mutating server state and publishing, and liveElementsResponse streaming fat-morph output patches. Broadcaster.closeAll is useful for stream lifecycle/tests. Importing type Handler from index collides with the Handler namespace export; example imports it from handler.ts directly.","tradeoff":"State is in-process and intentionally toy-level. The example validates architecture, not production persistence or distributed fanout.","next_action_hint":"Consider cleaning the public index export to avoid Handler namespace/type collision, e.g. rename namespace export to HandlerModule or remove namespace exports if wildcard exports are enough."}}
{"run":35,"commit":"0bec5b3","metric":102,"metrics":{"tests":102,"ts_files":35},"status":"keep","description":"Fix public index Handler type collision by renaming namespace export","timestamp":1779046105778,"segment":0,"confidence":5.1,"asi":{"hypothesis":"The public package root should allow importing the Handler type directly without colliding with a namespace export.","learned":"Renaming the namespace export from Handler to Handlers preserves grouped helper access while allowing `import type { Handler } from '../src/index.js'`. This avoids the type issue hit in the live-counter example.","tradeoff":"Plural namespace is slightly less symmetrical with other namespace exports, but it is clearer and avoids type/value namespace ambiguity.","next_action_hint":"Update README public API notes or add package-root usage examples to reinforce the intended imports."}}
{"run":36,"commit":"10b4b54","metric":105,"metrics":{"tests":105,"ts_files":36},"status":"keep","description":"Add handler error mapping for explicit HTTP responses","timestamp":1779046174725,"segment":0,"confidence":4.666666666666667,"asi":{"hypothesis":"Effect handlers should keep typed failures in the error channel but need an ergonomic boundary helper for mapping those failures to HTTP responses.","learned":"mapErrorResponse composes with plain handlers, withSignals decode failures, and exact routes. This lets apps turn schema/request errors into 400s without moving error handling into the Node adapter or router.","tradeoff":"The mapper returns a synchronous Response only; effectful error recovery can be added later if a concrete need appears.","next_action_hint":"Potential next slice: add a small NotFound/BadRequest error response helper set or leave app-specific. More valuable may be documenting the current prototype architecture thoroughly."}}
{"run":37,"commit":"80dcef7","metric":107,"metrics":{"tests":107,"ts_files":37},"status":"keep","description":"Add explicit empty response helper for command endpoints","timestamp":1779046234436,"segment":0,"confidence":4.458333333333333,"asi":{"hypothesis":"Command endpoints commonly return 204/202; an explicit helper improves readability without adding framework policy.","learned":"emptyResponse covers 204 defaults and alternate empty statuses/headers, and makes the live counter increment handler clearer than ad-hoc Response construction.","tradeoff":"Kept this minimal; no broad response factory hierarchy.","next_action_hint":"At this point core prototype is broad. Consider adding architecture notes/tradeoffs to README or autoresearch ideas rather than continuing to add tiny helpers."}}
{"run":38,"commit":"b720929","metric":110,"metrics":{"tests":110,"ts_files":38},"status":"keep","description":"Add object-form Datastar data-attr and data-class helpers","timestamp":1779046296332,"segment":0,"confidence":4.150943396226415,"asi":{"hypothesis":"Object-form binding helpers improve DX for multiple attributes/classes and special CSS class names without expanding the expression DSL.","learned":"dataAttrs and dataClasses serialize expression mappings into Datastar-compatible object expressions with quoted keys. This covers multi-attribute bindings and Tailwind-style class names containing ':' or '/' that are awkward as keyed attributes.","tradeoff":"Single-key dataAttr/dataClass remain for clarity. Object-form helper does not try to preserve base classes automatically; examples should decide class composition explicitly.","next_action_hint":"Possible next slice: add dataStyle/dataStyles helpers or stop and document. data-style is in Datastar docs and complements attrs/classes."}}
{"run":39,"commit":"b8b8a4e","metric":112,"metrics":{"tests":112,"ts_files":39},"status":"keep","description":"Add Datastar data-style helper family","timestamp":1779046352184,"segment":0,"confidence":3.8620689655172415,"asi":{"hypothesis":"Style bindings are part of Datastar's core attribute set and should mirror the single-key/object-form helper pattern used for attrs and classes.","learned":"dataStyle/dataStyles compose with signals and ternary expressions, completing a small consistent helper family: dataAttr(s), dataClass(es), dataStyle(s).","tradeoff":"No CSS object normalization or camel/kebab conversion yet; helper stays explicit and close to Datastar syntax.","next_action_hint":"Now the attr helper surface is broader. Consider writing a compact reference table in README, but a pure docs commit won't improve primary metric unless paired with examples/tests."}}
{"run":40,"commit":"b8b8a4e","metric":0,"metrics":{"tests":114,"ts_files":40},"status":"crash","description":"Signal patch filter helper tests failed due incorrect expected regex literal","timestamp":1779046400629,"segment":0,"confidence":3.8620689655172415,"asi":{"hypothesis":"Fill the helper gap around data-on-signal-patch-filter and compose it with signal patch listeners.","error_details":"Only failing test expected regex('^draft') to render /^draft without trailing slash; actual helper correctly renders /^draft/.","rollback_reason":"Test expectation failure; reverted per autoresearch rules.","next_action_hint":"Reapply with expected '{\"include\": /^draft/}'."}}
{"run":41,"commit":"73ee6de","metric":114,"metrics":{"tests":114,"ts_files":40},"status":"keep","description":"Add Datastar signal patch filter helper","timestamp":1779046437556,"segment":0,"confidence":4,"asi":{"hypothesis":"Signal patch filters are part of Datastar's reactive attribute surface and should compose with onSignalPatch helpers.","learned":"onSignalPatchFilter serializes include/exclude regex expressions into data-on-signal-patch-filter. It composes cleanly with onSignalPatch and strict attr merging. Regex helper always emits full /pattern/ literal syntax.","next_action_hint":"Potential next slice: add ref/jsonSignals/preserveAttr helpers to cover more documented Datastar attributes, but weigh against scope creep."}}
{"run":42,"commit":"3bdfb39","metric":118,"metrics":{"tests":118,"ts_files":41},"status":"keep","description":"Add helpers for data-ref, data-json-signals, and data-preserve-attr","timestamp":1779046501829,"segment":0,"confidence":4.068965517241379,"asi":{"hypothesis":"A few remaining simple Datastar attributes can be covered with thin helpers, improving self-documenting DX without new abstractions.","learned":"ref validates signal names and supports Signal inputs, jsonSignals handles inspector filters and terse mode, and preserveAttr is just a space-joined attr list. These stay close to Datastar syntax.","tradeoff":"Still not aiming for exhaustive Datastar attribute coverage; only adding low-cost primitives already used in docs/examples.","next_action_hint":"Could add data-ignore/data-ignore-morph helpers next, but consider whether the attr surface is becoming broad enough for this prototype."}}
{"run":43,"commit":"89cf064","metric":121,"metrics":{"tests":121,"ts_files":42},"status":"keep","description":"Add Datastar ignore and ignore-morph helpers","timestamp":1779046554619,"segment":0,"confidence":4.172413793103448,"asi":{"hypothesis":"data-ignore and data-ignore-morph are low-cost helpers for explicit Datastar boundaries, useful when integrating third-party DOM or preserving morph-sensitive islands.","learned":"ignore(), ignore({self:true}), and ignoreMorph() cover the documented attributes with no extra abstraction. The attribute helper surface is now broad enough for the prototype; further expansion risks chasing completeness.","next_action_hint":"Shift from adding helpers to writing concise architecture notes or refactoring docs. If metrics require code/tests, consider tests around examples staying importable from package root rather than new API surface."}}
{"run":44,"commit":"11129a1","metric":124,"metrics":{"tests":124,"ts_files":43},"status":"keep","description":"Allow HTML response helpers to render HTML nodes directly","timestamp":1779046671689,"segment":0,"confidence":4.275862068965517,"asi":{"hypothesis":"Response helpers should accept the framework's HTML nodes directly so app handlers don't need manual render(...) calls everywhere.","learned":"htmlResponse and htmlPatchResponse can take either raw HTML strings or HtmlNode/Child values. Strings remain raw for existing code, while nodes are rendered and escaped through the HTML renderer. Direct Datastar HTML patches now compose more ergonomically with h()/JSX output.","tradeoff":"String input remains raw HTML, so callers must still avoid passing untrusted strings as HTML. Node input is the safer path for generated content.","next_action_hint":"Update examples to use node-accepting htmlResponse/htmlPatchResponse directly, or leave as is to avoid churn. Another useful slice: expose a `renderPage`/doctype helper if examples keep hand-building full documents."}}
{"run":45,"commit":"c0fa6d7","metric":126,"metrics":{"tests":126,"ts_files":44},"status":"keep","description":"Add minimal HTML document helper","timestamp":1779046728379,"segment":0,"confidence":4.271186440677966,"asi":{"hypothesis":"Examples need full HTML pages often enough that a tiny doctype/document helper is clearer than hand-written strings.","learned":"htmlDocument composes the existing h()/render pipeline with doctype, lang, head, and body children, including datastarScript in head. It remains templating-agnostic and does not introduce a component system.","tradeoff":"Very small helper; no meta defaults, asset management, or layout abstraction. Good for examples but not a full page framework.","next_action_hint":"Update examples to use htmlDocument only if paired with tests or further example cleanup; otherwise consider adding README architecture summary outside metric loop."}}
{"run":46,"commit":"6046f25","metric":128,"metrics":{"tests":128,"ts_files":45},"status":"keep","description":"Add Node serve and close helpers for Effect handlers","timestamp":1779046824000,"segment":0,"confidence":4.266666666666667,"asi":{"hypothesis":"A minimal serve helper improves prototype runability while preserving the Web Request/Response handler model and avoiding a larger server framework.","learned":"serve(app) wraps createNodeListener with node:http listen defaults (127.0.0.1, ephemeral port), closeServer gives tests/apps an Effectful shutdown, and serverOrigin makes fetch-based tests straightforward.","tradeoff":"No scoped resource layer or CLI yet; this is a minimal start/close helper. Effect.scoped could be explored later if lifecycle needs grow.","next_action_hint":"Update examples to export runnable main or add package scripts only if needed. Otherwise focus on architecture docs and reviewing accumulated API for overreach."}}
{"run":47,"commit":"6046f25","metric":0,"metrics":{"tests":129,"ts_files":46},"status":"crash","description":"Scoped server helper failed typecheck because acquireRelease release action could fail","timestamp":1779046885173,"segment":0,"confidence":4.266666666666667,"asi":{"hypothesis":"Add an Effect.scoped server helper using acquireRelease for idiomatic lifecycle management.","error_details":"Effect.acquireRelease requires the release action to be infallible, but closeServer returns Effect<void, Error>.","rollback_reason":"Typecheck failure; reverted per autoresearch rules.","next_action_hint":"Reapply with release `(server) => Effect.orDie(closeServer(server))` or catch all close errors in the finalizer."}}
