{"run":48,"commit":"98b2c81","metric":129,"metrics":{"tests":129,"ts_files":46},"status":"keep","description":"Add scoped Node server helper for Effect lifecycles","timestamp":1779046925651,"segment":0,"confidence":4.526315789473684,"asi":{"hypothesis":"A scoped server helper fits Effect-style resource management better than only returning a manually closed Server.","learned":"serveScoped uses Effect.acquireRelease around serve/closeServer and must make the finalizer infallible, so close errors are orDie'd. Tests can fetch within Effect.scoped and rely on automatic cleanup.","tradeoff":"Close failures become defects in scoped finalization. This is acceptable for a prototype; richer lifecycle error handling can wait for concrete needs.","next_action_hint":"Now that server lifecycle exists, examples could expose small runnable entrypoints, but adding CLI/package scripts may be premature."}}
{"run":49,"commit":"e3e0b35","metric":130,"metrics":{"tests":130,"ts_files":46},"status":"keep","description":"Make examples return full Datastar documents","timestamp":1779047112243,"segment":0,"confidence":4.333333333333333,"asi":{"hypothesis":"Now that Node serve/scoped lifecycle helpers exist, examples should return full Datastar HTML documents with the client script rather than only fragments, so they are closer to runnable prototypes.","learned":"counter/search/live examples can share htmlDocument + datastarScript while preserving existing fragment helpers for tests and patches. Search and live root pages now include the Datastar client script instead of only returning a main fragment.","tradeoff":"Kept examples on the default local /datastar.js script path and did not add package scripts or CLI entrypoints yet; serving the client asset remains explicit for apps to wire as needed.","next_action_hint":"Consider adding a tiny appRoutes/pageRoutes composition helper for pairing root pages with datastarClientRoute, or improve SSE patch responses to accept HTML nodes like direct HTML responses."}}
{"run":50,"commit":"c2ffae2","metric":131,"metrics":{"tests":131,"ts_files":46},"status":"keep","description":"Allow SSE patch element responses to render HTML nodes","timestamp":1779047156127,"segment":0,"confidence":4.366666666666666,"asi":{"hypothesis":"SSE patch element responses should accept the same rendered HTML node inputs as direct HTML responses, reducing manual render(...) calls for streamed Datastar patches.","learned":"patchElementsResponse can reuse the response layer's HtmlContent rendering while keeping the lower-level sse.patchElements encoder pure string-based. Node inputs are escaped through the HTML renderer before becoming SSE data lines.","tradeoff":"The low-level SSE encoder still accepts strings only, preserving wire-focused purity and avoiding a dependency from sse.ts to the templating layer.","next_action_hint":"Consider updating examples/live-counter countFragment to return an HTML node directly, or add a small helper to pair a full page route with a Datastar client asset route."}}
{"run":51,"commit":"d63bd20","metric":133,"metrics":{"tests":133,"ts_files":46},"status":"keep","description":"Add Datastar document and page response helpers","timestamp":1779047337635,"segment":0,"confidence":4.433333333333334,"asi":{"hypothesis":"Factoring the repeated htmlResponse(htmlDocument({ head: datastarScript(), body })) pattern into Datastar document/page helpers will keep runnable pages explicit while reducing ceremony in examples.","learned":"datastarDocument and datastarPageResponse compose existing htmlDocument, datastarScript, and htmlResponse helpers without adding routing policy. Counter/search/live examples can now return full Datastar pages through a single helper while retaining fragment/node functions for patches and tests.","tradeoff":"The helper only injects the script tag and document shell; it does not automatically serve /datastar.js or introduce an app/router wrapper. Asset routing remains explicit via datastarClientRoute/datastarClientFileRoute.","next_action_hint":"Next consider adding a tiny route helper that pairs app routes with a Datastar client asset route, or update live-counter countFragment to return an HTML node directly now that patch streaming accepts nodes end-to-end."}}
{"run":52,"commit":"44c770c","metric":134,"metrics":{"tests":134,"ts_files":46},"status":"keep","description":"Make live counter patches node-based end-to-end","timestamp":1779047391696,"segment":0,"confidence":4.32258064516129,"asi":{"hypothesis":"Now that realtime and SSE patch response helpers render HTML nodes, the live counter example should return a node fragment directly instead of pre-rendering to a string.","learned":"liveElementsResponse already accepts Child values, so countFragment can stay as an HtmlNode and the broadcaster stream still emits the same Datastar patch-elements SSE. This keeps fragments composable for reuse in pages, patches, and tests.","tradeoff":"The example still renders pageView to a string for simple fixture assertions; deeper component/page factoring is deferred.","next_action_hint":"Next consider explicit Datastar client asset route composition for examples so the full pages that load /datastar.js also serve that route when run under node."}}
{"run":53,"commit":"4ddc464","metric":135,"metrics":{"tests":135,"ts_files":46},"status":"keep","description":"Add helper for pairing app routes with Datastar client asset route","timestamp":1779047497536,"segment":0,"confidence":4.5,"asi":{"hypothesis":"Full Datastar pages load /datastar.js, so prototypes need a small explicit way to pair exact app routes with the client asset route without hiding asset serving or adding a framework wrapper.","learned":"datastarClientRoutes(script, ...routes) prepends the default /datastar.js route and composes directly with the existing exact-route router. This keeps asset serving explicit and verifies a page route plus client route can be dispatched together.","tradeoff":"The helper intentionally only handles in-memory script content and the default path; file-backed assets remain explicit through datastarClientFileRoute to avoid overloading the route composition API too early.","next_action_hint":"Consider a file-backed companion helper only if examples start wiring the real ../datastar.js asset repeatedly; otherwise improve diagnostics around missing client asset or route/method errors."}}
{"run":54,"commit":"0654964","metric":136,"metrics":{"tests":136,"ts_files":46},"status":"keep","description":"Stream Web Response bodies through the Node adapter","timestamp":1779047617816,"segment":0,"confidence":4.459016393442623,"asi":{"hypothesis":"The Node adapter must stream Web Response bodies chunk-by-chunk because buffering response.arrayBuffer() prevents long-lived Datastar SSE/live responses from delivering events under node:http.","learned":"writeWebResponse can use Response.body.getReader() and write each Uint8Array to ServerResponse as it arrives, preserving headers and backpressure via drain. A node:http fetch test now observes the first SSE chunk before the response body closes.","tradeoff":"The adapter remains intentionally small: no advanced abort propagation or custom high-watermark handling yet. Stream errors still surface through the existing listener error path.","next_action_hint":"Next consider abort propagation from closed Node clients to Web stream readers/subscriptions, or add a runnable live-counter Node test that proves Broadcaster SSE works through serve()."}}
{"run":55,"commit":"80df531","metric":137,"metrics":{"tests":137,"ts_files":46},"status":"keep","description":"Flush Node streaming headers before first body chunk","timestamp":1779047689283,"segment":0,"confidence":4.724137931034483,"asi":{"hypothesis":"Datastar SSE clients should receive response headers and establish the stream even when the first event is delayed, so the Node adapter should flush headers before reading streaming body chunks.","learned":"Calling ServerResponse.flushHeaders() after setting response headers and before reading the Web Response body lets fetch resolve on headers before the first async event is produced. This avoids deadlocks for live streams that wait for later publishes.","tradeoff":"Headers are committed before the stream body completes, so later stream failures cannot change the HTTP status. That is normal for long-lived SSE responses and matches the explicit streaming boundary.","next_action_hint":"Add an integration test for the live-counter example through serve() to verify a broadcaster-backed Datastar stream works over real node:http with header flushing and chunk streaming."}}
{"run":56,"commit":"8f1a389","metric":138,"metrics":{"tests":138,"ts_files":46},"status":"keep","description":"Verify live counter SSE through node:http serve helper","timestamp":1779047732057,"segment":0,"confidence":4.677966101694915,"asi":{"hypothesis":"After adding chunk streaming and header flushing to the Node adapter, a real broadcaster-backed live counter should stream Datastar SSE updates through serve() over node:http.","learned":"The live counter example can be served with serve(liveCounter.app), fetch /live to establish an SSE stream, POST /increment over the same Node app, and receive a patch-elements event over the network before closing the broadcaster subscription.","tradeoff":"This is an integration test rather than new API surface. It validates the runtime boundary without adding a broader server framework or CLI entrypoint.","next_action_hint":"Next consider propagating client disconnects/abort signals to subscriptions so long-lived Broadcaster streams are cleaned up when a browser closes the SSE connection."}}
{"run":57,"commit":"8f1a389","metric":0,"metrics":{"tests":140,"ts_files":46},"status":"crash","description":"SSE disconnect cleanup attempt failed because node:http client cancel did not close subscription","timestamp":1779047891008,"segment":0,"confidence":4.677966101694915,"asi":{"hypothesis":"Propagate SSE response cancellation to async iterators/subscriptions so long-lived broadcaster streams are cleaned up when clients disconnect.","error_details":"Unit-level response-body cancellation likely worked, but the node:http integration test still observed broadcaster.size() === 1 after fetch body reader.cancel(). The server-side close signal was not sufficient or not observed by the adapter within the polling window.","rollback_reason":"Test failure; reverted per autoresearch rules.","next_action_hint":"Reapply a smaller slice first: keep eventStreamResponse cancel/Subscription.return with a unit test, and defer node/http disconnect propagation until a reliable abort signal strategy is designed."}}
{"run":58,"commit":"264bec9","metric":139,"metrics":{"tests":139,"ts_files":46},"status":"keep","description":"Cancel SSE async iterators when response bodies are canceled","timestamp":1779047952488,"segment":0,"confidence":4.793103448275862,"asi":{"hypothesis":"A smaller reliable cancellation primitive should close async iterators/subscriptions when an SSE Response body itself is canceled, even if full node/http disconnect propagation needs more design.","learned":"eventStreamResponse can be implemented with a pull/cancel ReadableStream and an explicit async iterator. BroadcastSubscription now implements return() by closing itself, so canceling the Response body releases the broadcaster subscription at the pure Web Response boundary.","tradeoff":"This does not yet prove that every Node client disconnect reaches the Web Response cancel path; the prior node/http integration attempt was flaky/ineffective. The reliable primitive is still useful for controlled cancellation and future adapter work.","next_action_hint":"Revisit Node disconnect propagation by passing an AbortSignal from IncomingMessage/ServerResponse into writeWebResponse or by testing with a lower-level HTTP client instead of fetch reader.cancel()."}}
{"run":59,"commit":"cf4871e","metric":140,"metrics":{"tests":140,"ts_files":46},"status":"keep","description":"Cancel Node streaming response readers on client socket close","timestamp":1779048058333,"segment":0,"confidence":4.912280701754386,"asi":{"hypothesis":"Node disconnect cleanup can be made reliable by listening to ServerResponse.close and canceling the Web Response reader, while testing with a lower-level node:http client that actually destroys the socket instead of fetch reader.cancel().","learned":"writeWebResponse now cancels the Web response reader when ServerResponse emits close, which lets eventStreamResponse invoke iterator.return() and release subscriptions. A node:http client destroying the response verifies the server observes the disconnect and cancels the never-ending SSE iterator.","tradeoff":"This handles the Node adapter boundary but still does not expose a request AbortSignal to app handlers. Chunk writes now also reject if the response closes before drain, keeping the streaming loop from hanging.","next_action_hint":"Next consider exposing request abort/cancellation to handlers if app effects need cleanup beyond response-body streams; otherwise improve route diagnostics or typed response error helpers."}}
{"run":60,"commit":"c886f3f","metric":141,"metrics":{"tests":141,"ts_files":46},"status":"keep","description":"Abort Web Request signals on Node client disconnect","timestamp":1779048134618,"segment":0,"confidence":4.862068965517241,"asi":{"hypothesis":"Once ServerResponse.close is observed in the Node adapter, the same disconnect should also abort the Web Request.signal so handlers can clean up app-level effects beyond response stream iterator cancellation.","learned":"createNodeListener now creates an AbortController per request, passes its signal into nodeRequestToWeb, and aborts it on ServerResponse.close. A low-level node:http client destroying an SSE response verifies handlers can observe request.signal abort.","tradeoff":"The signal aborts on response close, including normal completion after the handler boundary. This is acceptable for Web Request semantics at the adapter edge; long-running handlers can use it for disconnect cleanup, while completed handlers ignore it.","next_action_hint":"Consider adding a tiny helper to turn Request.signal into an Effect interruption/abort primitive, or shift to docs explaining streaming/disconnect lifecycle now that runtime behavior is covered."}}
{"run":61,"commit":"9f885c5","metric":143,"metrics":{"tests":143,"ts_files":47},"status":"keep","description":"Add Effect helpers for awaiting request abort signals","timestamp":1779048264368,"segment":0,"confidence":5.017543859649122,"asi":{"hypothesis":"Handlers should be able to compose client-disconnect cleanup in Effect without writing raw AbortSignal event-listener boilerplate.","learned":"waitForAbortSignal and waitForRequestAbort expose AbortSignal/Request.signal as Effect<void>. They complete immediately for already-aborted signals and register a once listener otherwise, with cleanup through Effect.async's returned finalizer.","tradeoff":"The helper only waits for abort; it does not prescribe racing/interruption policy or response shape. App handlers can choose how to compose it with their own Effects.","next_action_hint":"Consider a small documented example or helper showing race of long-running work against waitForRequestAbort, but avoid introducing broad cancellation policy until needed."}}
{"run":62,"commit":"9f885c5","metric":0,"metrics":{"tests":145,"ts_files":47},"status":"crash","description":"Abort racing helper attempt timed out when abort failure raced Effect.never","timestamp":1779051447800,"segment":0,"confidence":5.017543859649122,"asi":{"hypothesis":"Add minimal racing helpers withAbortSignal/withRequestAbort so handlers can fail long-running Effects with a typed RequestAbortError when clients disconnect.","error_details":"The test racing Effect.never against an abort-triggered failure timed out. Effect.raceFirst with a failing abort branch did not resolve as expected in this shape, likely because failure semantics/loser interruption were not appropriate for the intended helper.","rollback_reason":"Test timeout; reverted per autoresearch rules.","next_action_hint":"Reapply with a success-valued abort result or use Effect.raceWith/either carefully. Simpler option: keep wait helpers only and add a documented helper that maps abort to a success discriminant instead of a failure."}}
{"run":63,"commit":"9f885c5","metric":0,"metrics":{"tests":145,"ts_files":47},"status":"crash","description":"Success-valued abort race helper still timed out against Effect.never","timestamp":1779054301011,"segment":0,"confidence":5.017543859649122,"asi":{"hypothesis":"Use a success-valued Completed/Aborted discriminated union with disconnected race branches so handlers can compose abort races without failure semantics issues.","error_details":"The Aborted branch still timed out when racing against Effect.never, even after mapping abort to success and wrapping race branches with Effect.disconnect. Effect.never is a poor test target or raceFirst is not the right primitive for this helper shape.","rollback_reason":"Test timeout; reverted per autoresearch rules.","next_action_hint":"Do not ship a generic race helper yet. Reapply a smaller helper that maps AbortSignal/Request abort into a success-valued discriminant without racing arbitrary work, or first study Effect.raceWith semantics with a non-never interruptible task."}}
{"run":64,"commit":"2ed716d","metric":145,"metrics":{"tests":145,"ts_files":47},"status":"keep","description":"Expose abort reasons as composable Effects","timestamp":1779059612077,"segment":0,"confidence":5,"asi":{"hypothesis":"After two failed generic abort-race attempts, a smaller reliable helper should expose AbortSignal/Request abort reasons as Effects without racing arbitrary work.","learned":"abortSignalReason and requestAbortReason compose with the existing wait helpers and read signal.reason after abort, preserving custom disconnect reasons such as 'client closed' or 'gone'. This avoids the tricky Effect.raceFirst + Effect.never semantics that caused timeouts.","tradeoff":"No generic withAbort/race helper is shipped yet; apps can combine the reason Effect with their own Effect patterns once a concrete use case clarifies the right interruption semantics.","next_action_hint":"Move away from generic abort racing for now. Consider documenting streaming/disconnect lifecycle or adding higher-level response helpers for common error/status cases."}}
{"run":65,"commit":"991871a","metric":150,"metrics":{"tests":150,"ts_files":47},"status":"keep","description":"Support status and custom headers in HTML and direct Datastar responses","timestamp":1779062642471,"segment":0,"confidence":5.357142857142857,"asi":{"hypothesis":"HTML and direct Datastar response helpers should preserve safe default content types while allowing handlers to set HTTP status and custom headers for accepted/queued/error response cases.","learned":"htmlResponse now accepts ResponseInit and preserves caller headers/content-type overrides. htmlPatchResponse, jsonSignalsResponse, and scriptResponse accept init through their options, keeping Datastar-specific headers layered on top of custom status/headers.","tradeoff":"SSE response helpers remain unchanged because their call shape is variadic event strings; adding ResponseInit there needs a separate API decision. Direct single-shot responses now cover the common customization path.","next_action_hint":"Consider a separate sseResponseWithInit or eventStreamResponse option only if concrete examples need custom SSE status/headers; otherwise focus on docs or small file-backed client route composition."}}
{"run":66,"commit":"58ec402","metric":155,"metrics":{"tests":155,"ts_files":48},"status":"keep","description":"Support status and custom headers in SSE response helpers","timestamp":1779062936318,"segment":0,"confidence":5.535714285714286,"asi":{"hypothesis":"SSE response helpers and realtime streams should offer the same status/custom header capability as direct responses while preserving required Datastar/SSE default headers.","learned":"sseHeaders now merges caller headers with text/event-stream, no-cache, and keep-alive defaults. sseResponseWithInit, patchElementsResponse/patchSignalsResponse init args, eventStreamResponse init, and liveElementsResponse init cover raw, Datastar patch, async, and live streaming responses.","tradeoff":"sseResponse keeps its existing variadic event-string API for compatibility; custom init uses the explicit sseResponseWithInit helper. This avoids ambiguous overloads while still enabling advanced headers/statuses.","next_action_hint":"Consider small response helpers for common typed errors/statuses, or document the now-complete direct/SSE response customization matrix."}}
{"run":67,"commit":"a280c56","metric":156,"metrics":{"tests":156,"ts_files":48},"status":"keep","description":"Add file-backed Datastar client route composition helper","timestamp":1779063023281,"segment":0,"confidence":5.672727272727273,"asi":{"hypothesis":"Apps/examples that load /datastar.js should be able to pair exact app routes with the real self-hosted datastar.js file route without hand-writing route arrays, while keeping asset serving explicit.","learned":"datastarClientFileRoutes(filePath, ...routes) mirrors the in-memory datastarClientRoutes helper and composes directly with the exact-route router. A test verifies a full page route and the included ../datastar.js asset dispatch together through one router.","tradeoff":"The helper intentionally uses the default /datastar.js path only; custom path/cache options still use the explicit datastarClientFileRoute for now to avoid an overloaded composition API.","next_action_hint":"Consider adding an option bag to datastarClientFileRoutes only if custom path/cache composition is repeatedly needed; otherwise shift toward docs/examples or small route diagnostics."}}
