{"type":"config","name":"Effect Datastar TypeScript prototype capability loop","metricName":"prototype_score","metricUnit":"","bestDirection":"higher"}
{"run":1,"commit":"236541d","metric":0,"metrics":{"tests":0,"ts_files":0},"status":"keep","description":"Baseline before implementing ts-star prototype; research plan and benchmark script only","timestamp":1779043462781,"segment":0,"confidence":null,"asi":{"hypothesis":"Establish a zero-capability baseline and commit the autoresearch harness before adding the first vertical slice.","study_summary":"Datastar favors backend-owned state, SSE element/signal patches, fat morphs, sparse signals; strongest borrowed ideas are Stario small SSE helpers, StarHTML typed expression DSL, Hyperlith explicit CQRS/fat morph, Falco typed helpers."}}
{"run":2,"commit":"236541d","metric":0,"metrics":{"tests":18,"ts_files":8},"status":"crash","description":"First vertical slice attempt failed one HTML expectation around false reactive attr rendering","timestamp":1779043733969,"segment":0,"confidence":null,"asi":{"hypothesis":"Add the minimal Datastar SSE, HTML, typed signal/action, Effect signal decoding, and counter handler slice.","error_details":"Vitest had 17/18 passing; only html-datastar counter render expected data-attr:disabled=false to be omitted, but renderer correctly treats string attribute value \"false\" as present because Datastar expressions are strings.","rollback_reason":"Failed test run; per autoresearch rules crash logs and reverts the attempted slice.","next_action_hint":"Reapply the slice with the test expectation fixed or remove the dataAttr('disabled', false) from the view. Prefer not emitting the false expression in this fixture because reactive attributes intentionally use string expressions."}}
{"run":3,"commit":"154d926","metric":18,"metrics":{"tests":18,"ts_files":10},"status":"keep","description":"Implement minimal vertical slice: Datastar SSE encoding, typed signal/action HTML helpers, Effect Schema signal decoding, and counter handler","timestamp":1779043915811,"segment":0,"confidence":null,"asi":{"hypothesis":"A small pure core plus Effect Schema request decoding can prove the framework shape without committing to JSX, routers, or CQRS machinery.","learned":"The minimal slice is coherent: golden-like SSE strings, typed signal refs, HTML rendering, Web Request signal parsing, and Effect handlers all compose in tests. Reactive data-* expression values are strings even when the expression is false; omit attrs only for HTML boolean false, not Datastar expression strings.","architecture_validated":["pure sse.ts wire encoder is easy to golden-test","datastar.ts expression/attribute helpers provide type safety without much ceremony","request.ts can decode GET query and POST body signals with Effect Schema","vertical counter handler can stay a plain Effect returning a Web Response"],"next_action_hint":"Add a stronger compile-time type-safety test for signal value operations, plus exact comparisons against more included SDK fixtures such as namespace/multiline signal and remove signal cases."}}
{"run":4,"commit":"feb0d3f","metric":23,"metrics":{"tests":23,"ts_files":12},"status":"keep","description":"Expand Datastar protocol coverage with more SDK fixtures and compile-time signal safety checks","timestamp":1779044002305,"segment":0,"confidence":null,"asi":{"hypothesis":"The direct SSE encoder should match additional official SDK fixtures, and the typed Signal API should reject common misuse at TypeScript compile time.","learned":"executeScript is a datastar-patch-elements event with mode append before selector body, unlike general patchElements option ordering. removeSignals is just patchSignals with null leaves, including nested dot paths. @ts-expect-error tests confirm number/boolean signal operation constraints and declared signal-record keys.","next_action_hint":"Prototype a small Effect-aware route abstraction or CQRS live stream helper next, but keep it thin and explicit. Consider adding exact server example using Node's Web Request/Response before any router abstraction."}}
{"run":5,"commit":"feb0d3f","metric":0,"metrics":{"tests":28,"ts_files":13},"status":"crash","description":"Thin Effect handler/router attempt failed typecheck due Headers.entries lib typing and duplicate HttpMethod export","timestamp":1779044072812,"segment":0,"confidence":null,"asi":{"hypothesis":"Add a minimal exact router and withSignals helper without introducing full framework routing abstractions.","error_details":"tsc failed before tests: Headers.entries is missing from current lib typing in this configuration, and index.ts wildcard exports caused duplicate HttpMethod from datastar.ts and handler.ts.","rollback_reason":"Typecheck failure; reverted per autoresearch rules.","next_action_hint":"Reapply with Array.from(new Headers(...)) or forEach instead of entries, and rename handler HttpMethod to RouteMethod or avoid wildcard conflict."}}
{"run":6,"commit":"b917c2b","metric":28,"metrics":{"tests":28,"ts_files":14},"status":"keep","description":"Add thin Effect handler utilities with typed signal decoding and exact-route dispatch","timestamp":1779044136405,"segment":0,"confidence":5.6,"asi":{"hypothesis":"A tiny Handler type, withSignals helper, and exact router can improve DX while keeping routing explicit and reversible.","learned":"The handler layer can stay very small: Web Request to Effect<Response>, exact route matching, built-in 404/405, and withSignals composition. Avoided middleware/params. Type issue fixed by renaming handler method type to RouteMethod and using Headers directly instead of entries.","next_action_hint":"Next useful slice is Node runtime adapter or realtime/CQRS helper. Prefer Node adapter first so the vertical slice can run under node:http with Web Request/Response semantics."}}
{"run":7,"commit":"b917c2b","metric":0,"metrics":{"tests":33,"ts_files":16},"status":"crash","description":"Node adapter attempt failed typecheck on Buffer BodyInit and overly strict createNodeListener requirements","timestamp":1779044217506,"segment":0,"confidence":5.6,"asi":{"hypothesis":"Add a Node http adapter around the Web Request/Response handler model.","error_details":"tsc failed: Buffer<ArrayBufferLike> not assignable to DOM BodyInit, and createNodeListener accepted Handler<unknown, never> so tests with Handler<any, any> were rejected.","rollback_reason":"Typecheck failure; reverted per autoresearch rules.","next_action_hint":"Reapply using body.buffer.slice(...) or Uint8Array ArrayBuffer-safe conversion, and make createNodeListener accept Handler<unknown, any> or Handler<unknown, never> with a less restrictive R type."}}
{"run":8,"commit":"c7236a1","metric":33,"metrics":{"tests":33,"ts_files":16},"status":"keep","description":"Add Node http adapter for Web Request/Response Effect handlers","timestamp":1779044306900,"segment":0,"confidence":6.6,"asi":{"hypothesis":"A Node runtime adapter can keep the framework API on Web Request/Response while still targeting node:http.","learned":"The adapter works with real node:http + fetch tests: exact route serving, POST body signal decoding, router 404s, default 500s, and custom error responses. TypeScript DOM BodyInit does not accept Buffer directly, so body conversion uses an ArrayBuffer slice. createNodeListener currently casts Handler requirements to never, so handlers needing services should be provided before adaptation.","tradeoff":"This is intentionally a boundary adapter, not a server abstraction. It avoids taking over listen/lifecycle concerns for now.","next_action_hint":"Next explore realtime/CQRS helper as an optional pattern: a small in-process broadcaster or stream response that sends fat morph patches from Effect Streams."}}
{"run":9,"commit":"dd27326","metric":38,"metrics":{"tests":38,"ts_files":18},"status":"keep","description":"Add optional realtime helpers for broadcaster-backed Datastar SSE streams","timestamp":1779044393326,"segment":0,"confidence":7.6,"asi":{"hypothesis":"Realtime can be modeled as a tiny optional primitive: publish values, map them to fat-morph element patches, and stream them as text/event-stream responses.","learned":"A minimal Broadcaster + AsyncIterable bridge is enough to prove the CQRS/live-update shape without introducing a complex sync engine. The API remains explicit: app code decides what values to publish and how to render them to Datastar patches.","tradeoff":"This broadcaster is in-process and not production durable; it is a prototype pattern. For real deployment, the same AsyncIterable shape could wrap NATS/Redis/Postgres notifications.","next_action_hint":"Add a README/example that explains the current architecture and demonstrates the counter plus live stream. Documentation is now valuable because the prototype has several coherent primitives."}}
{"run":10,"commit":"71b0f13","metric":42,"metrics":{"tests":42,"ts_files":19},"status":"keep","description":"Document architecture and add tested counter example","timestamp":1779044456921,"segment":0,"confidence":5.6,"asi":{"hypothesis":"Now that core primitives are coherent, a README and executable counter example will improve DX clarity and serve as a regression fixture.","learned":"The architecture can be explained compactly as pure SSE, typed Datastar helpers, tiny HTML rendering, Effect Schema request decoding, plain Effect handlers, Node adapter, and optional realtime helpers. The counter example exercises these without adding framework-level generalization.","next_action_hint":"Improve templating ergonomics next. Either add a safer attr-fragment API for common Datastar patterns or test a small JSX factory experiment; keep it reversible."}}
{"run":11,"commit":"71b0f13","metric":0,"metrics":{"tests":45,"ts_files":20},"status":"crash","description":"JSX templating experiment failed typecheck on children typing and fragment factory shape","timestamp":1779044519484,"segment":0,"confidence":5.6,"asi":{"hypothesis":"A classic JSX factory can be a reversible templating alternative over the existing HTML node model.","error_details":"TSX failed: IntrinsicElements index signature did not allow JSX children arrays, and Fragment as a Symbol was not accepted as a JSX element type for <> fragments.","rollback_reason":"Typecheck failure; reverted per autoresearch rules.","next_action_hint":"Reapply with a callable/string Fragment marker and broader JSX children typing, e.g. allow children?: any and AttributeValue | Child in JSX attributes, or skip <> fragment support initially."}}
{"run":12,"commit":"71b0f13","metric":0,"metrics":{"tests":45,"ts_files":20},"status":"crash","description":"Fixed JSX fragment typing attempt still failed narrowing callable Fragment vs string tag","timestamp":1779044577925,"segment":0,"confidence":5.6,"asi":{"hypothesis":"A callable Fragment and broader JSX attr typing should make classic JSX work over the HTML model.","error_details":"tsc still failed: after checking tag === Fragment, TypeScript did not narrow JsxTag to string for h(tag,...).","rollback_reason":"Typecheck failure; reverted per autoresearch rules.","next_action_hint":"Reapply with an explicit typeof tag === 'string' branch (or cast tag as string after the Fragment branch)."}}
{"run":13,"commit":"71b0f13","metric":0,"metrics":{"tests":45,"ts_files":20},"status":"crash","description":"JSX factory typechecked but tests failed because transform injected __self and __source attrs","timestamp":1779044628334,"segment":0,"confidence":5.6,"asi":{"hypothesis":"A classic JSX factory with callable Fragment can render through existing HTML nodes.","error_details":"Vitest/TSX transform passed __self and __source props into the factory, and renderer emitted them as HTML attributes in all JSX tests.","rollback_reason":"Test failure; reverted per autoresearch rules.","next_action_hint":"Filter dev-only JSX props (__self, __source) in the jsx factory before passing attrs to h()."}}
{"run":14,"commit":"71b0f13","metric":42,"metrics":{"tests":45,"ts_files":20},"status":"discard","description":"JSX factory experiment passed but primary metric did not improve because benchmark ignored .tsx tests","timestamp":1779044697487,"segment":0,"confidence":4.666666666666667,"asi":{"hypothesis":"A classic JSX factory can be a reversible templating alternative over the existing HTML node model.","learned":"The JSX factory now works after filtering dev-only __self/__source props and using a callable Fragment. However the autoresearch primary metric script only counts .test.ts/.spec.ts files, so the new passing .tsx tests were invisible to prototype_score even though vitest reported 45 passing tests.","rollback_reason":"Primary metric was unchanged at 42; per autoresearch rules equal primary metrics are discarded. The benchmark definition needs to be fixed to count .tsx tests before reattempting JSX.","next_action_hint":"First update autoresearch.sh to count .test.tsx/.spec.tsx in prototype_score, then reapply the JSX factory and tests so the metric reflects the intended capability count without overfitting."}}
{"run":15,"commit":"9231b80","metric":45,"metrics":{"tests":45,"ts_files":21},"status":"keep","description":"Add reversible JSX templating experiment and count TSX tests in prototype score","timestamp":1779044801189,"segment":0,"confidence":6.428571428571429,"asi":{"hypothesis":"JSX can be offered as a thin optional templating layer over the existing HTML node model without changing the core architecture.","learned":"Classic JSX works after using a callable Fragment, broad JSX attr typing, explicit string tag cast, and filtering dev-only __self/__source props. The benchmark now correctly counts .test.tsx/.spec.tsx tests, aligning prototype_score with the stated metric of passing prototype test cases rather than only .ts tests.","tradeoff":"JSX is currently just a reversible factory over h()/render(); Datastar attr fragments still come from helper spreads, so this does not commit to a React-like component model or client framework.","next_action_hint":"Next most promising improvement is better Datastar DX around typed attributes/options: add helper builders for event modifiers (debounce, delay, once) and action options, or add safer signal name validation."}}
{"run":16,"commit":"1e472d9","metric":51,"metrics":{"tests":51,"ts_files":22},"status":"keep","description":"Add typed Datastar event modifier helpers for common timing and listener suffixes","timestamp":1779044927659,"segment":0,"confidence":7.285714285714286,"asi":{"hypothesis":"Typed modifier builders will improve Datastar DX without adding magic, by making documented suffix syntax easier and less error-prone.","learned":"The helper API can cover data-on, data-on-intersect, data-on-interval, and data-on-signal-patch with simple object options. Tags must be grouped on one modifier suffix (for example __debounce.500ms.leading, not repeated __debounce segments). For data-on, target/control modifiers before timing produces documented examples like __window__debounce.500ms.leading.","next_action_hint":"Add safer signal-name/path validation next. Current signal(name) accepts arbitrary strings at runtime; a small runtime validator plus typed constructor can catch invalid Datastar signal names early without changing app architecture."}}
{"run":17,"commit":"1e472d9","metric":0,"metrics":{"tests":57,"ts_files":23},"status":"crash","description":"Signal name validation attempt failed typecheck because Error has name property","timestamp":1779044997867,"segment":0,"confidence":7.285714285714286,"asi":{"hypothesis":"Add runtime validation for signal names/paths and dataSignals keys to catch malformed Datastar interactions early.","error_details":"tsc failed: SignalNameError constructor used a parameter property named `name`, which overrides Error.name under noImplicitOverride and requires an override modifier.","rollback_reason":"Typecheck failure; reverted per autoresearch rules.","next_action_hint":"Reapply with the field renamed to signalName (or explicit override if desired)."}}
{"run":18,"commit":"97ded50","metric":57,"metrics":{"tests":57,"ts_files":23},"status":"keep","description":"Validate Datastar signal names and dataSignals keys at runtime","timestamp":1779045047013,"segment":0,"confidence":6.333333333333333,"asi":{"hypothesis":"Early runtime validation of signal names will prevent confusing Datastar case conversion/addressing bugs without adding architectural complexity.","learned":"Signal constructor and path() can validate dot-separated JS-identifier-like paths, including local underscore-prefixed signals. dataSignals can recursively validate object keys while leaving Expr values alone. Renaming SignalNameError.name to signalName avoids conflict with Error.name under noImplicitOverride.","tradeoff":"The validator intentionally rejects hyphenated signal names even though Datastar can case-convert some attributes, because typed server helpers should prefer explicit stable signal paths.","next_action_hint":"Add typed response helpers for HTML response header variants and Datastar text/html/json direct response modes, or add a static Datastar client asset helper for serving datastar.js in the Node adapter."}}
{"run":19,"commit":"97ded50","metric":0,"metrics":{"tests":62,"ts_files":24},"status":"crash","description":"Datastar client asset helper attempt failed typecheck because Uint8Array is not DOM BodyInit","timestamp":1779045119171,"segment":0,"confidence":6.333333333333333,"asi":{"hypothesis":"Add explicit helpers for rendering and serving the self-hosted Datastar client script.","error_details":"tsc failed: Response constructor BodyInit typing in this config does not accept Uint8Array<ArrayBufferLike> directly.","rollback_reason":"Typecheck failure; reverted per autoresearch rules.","next_action_hint":"Reapply converting Uint8Array to an ArrayBuffer slice (same lesson as Node adapter Buffer body conversion) or restrict datastarClientResponse to string."}}
{"run":20,"commit":"93f9594","metric":62,"metrics":{"tests":62,"ts_files":25},"status":"keep","description":"Add Datastar client script and asset-serving helpers","timestamp":1779045172521,"segment":0,"confidence":6.888888888888889,"asi":{"hypothesis":"Since Datastar's browser script is a core runtime asset, ts-star should make self-hosting it explicit and easy to test.","learned":"A small client.ts can cover script tag rendering, CDN fallback, static script responses, in-memory routes, and file-backed routes for the included minified datastar.js. Uint8Array response bodies need ArrayBuffer slice conversion under the current DOM typings.","tradeoff":"The helper does not bundle/copy datastar.js or assume a deployment layout; apps still decide whether to use CDN, in-memory content, or a file route.","next_action_hint":"Improve response ergonomics next: Datastar can also consume direct text/html and application/json responses with Datastar headers. Add helpers for html patch headers and json signal patch headers, not just SSE."}}
{"run":21,"commit":"b0b6456","metric":66,"metrics":{"tests":66,"ts_files":26},"status":"keep","description":"Add direct Datastar action response helpers for HTML, JSON signals, and scripts","timestamp":1779045241840,"segment":0,"confidence":5.739130434782608,"asi":{"hypothesis":"Datastar apps should not be forced into SSE for single-shot actions; helpers for documented direct response content types improve framework completeness and DX.","learned":"Direct response helpers are straightforward: text/html uses datastar-selector/mode/use-view-transition headers, application/json uses datastar-only-if-missing, and text/javascript uses datastar-script-attributes. This complements SSE helpers without changing handler architecture.","next_action_hint":"Next useful slice: improve request decoding for form mode or query/body edge cases, e.g. DELETE uses query signals like GET, empty POST body defaults to {}, malformed JSON reports SignalJsonError."}}
{"run":22,"commit":"b0b6456","metric":0,"metrics":{"tests":71,"ts_files":27},"status":"crash","description":"Request edge-case tests failed because Effect.runPromise wraps failures in FiberFailure","timestamp":1779045303665,"segment":0,"confidence":5.739130434782608,"asi":{"hypothesis":"Harden request decoding around Datastar request headers, DELETE query signals, empty bodies, raw payloads, and malformed JSON errors.","error_details":"Only failing test expected runPromise rejection to be instanceof SignalJsonError, but Effect.runPromise rejects with a FiberFailure wrapper around the typed error.","rollback_reason":"Test failure; reverted per autoresearch rules.","next_action_hint":"Reapply using Effect.either(readSignals(...)) in the malformed JSON test to inspect the typed error channel directly."}}
{"run":23,"commit":"d82ebab","metric":71,"metrics":{"tests":71,"ts_files":27},"status":"keep","description":"Harden Datastar request helpers for headers and signal payload edge cases","timestamp":1779045352384,"segment":0,"confidence":5.071428571428571,"asi":{"hypothesis":"Request decoding should cover documented Datastar request mechanics and expose small utilities for framework/app code.","learned":"GET and DELETE use query signals, empty non-GET bodies should decode as {}, rawSignalsFromRequest remains useful for custom decoders, and typed Effect failures should be tested via Effect.either instead of expecting runPromise to reject with the raw error. isDatastarRequest is a simple header check for Datastar-Request: true.","next_action_hint":"Next promising slice: add route params or query decoding? Be careful: route params add router complexity. Prefer query decoding with Effect Schema, since Datastar examples often use query resources and it stays small."}}
