{"run":86,"commit":"634dc5b","metric":125,"metrics":{"tests":125,"ts_files":37},"status":"keep","description":"Add Effect Stream heartbeat helpers for SSE responses","timestamp":1779067990785,"segment":0,"confidence":8.045454545454545,"asi":{"hypothesis":"Long-lived Datastar/SSE streams should use Effect Stream scheduling for keepalive heartbeats instead of manual timers or ad-hoc async generators.","learned":"`heartbeatStream` uses `Stream.tick` to produce SSE comment frames, `sseComment` handles multiline comments, and `withHeartbeat` merges keepalives into an event stream while halting when the primary event stream ends. This follows the Stream scheduling/merging docs and keeps streaming logic declarative.","tradeoff":"Heartbeat helpers live in realtime.ts rather than pure sse.ts because they depend on Effect Stream/Duration. They are opt-in and do not change existing response behavior.","next_action_hint":"Next promising iteration: use `withHeartbeat` in the live counter route or add a documented example showing PubSub updates plus scheduled heartbeats through the platform server."}}
{"run":87,"commit":"634dc5b","metric":0,"metrics":{"tests":126,"ts_files":37},"status":"crash","description":"First response-level heartbeat/live-counter integration emitted heartbeats before patches","timestamp":1779068173676,"segment":0,"confidence":8.045454545454545,"asi":{"hypothesis":"Expose heartbeat options on realtime response helpers and use them in the live counter route so PubSub-backed SSE examples have scheduled keepalives by default.","error_details":"Tests failed because the live counter's 15-second heartbeat unexpectedly emitted immediately under Stream.tick, causing the first node/http chunk to contain a `: live-counter` comment before the patch. The direct in-memory response test also produced an empty body after shutdown because merging heartbeat with the PubSub stream changed termination/race behavior.","rollback_reason":"Test failure and afterEach timeout; autoresearch crash rollback required.","next_action_hint":"Reapply response-level heartbeat as opt-in only, but do not enable it by default in live-counter. Validate the option with a focused response-helper test that reads/cancels one heartbeat chunk from a never-ending stream instead of changing existing live example chunk ordering."}}
{"run":88,"commit":"f23b313","metric":126,"metrics":{"tests":126,"ts_files":37},"status":"keep","description":"Add opt-in heartbeat options to realtime response helpers","timestamp":1779068234063,"segment":0,"confidence":8.232558139534884,"asi":{"hypothesis":"Heartbeat scheduling belongs as an opt-in response-helper option so apps can attach keepalive comments without manually merging streams, while preserving existing live-stream event ordering by default.","learned":"`eventStreamResponse` now accepts `heartbeat` in realtime response options, converts async iterable sources to Effect Streams when needed, strips the option before passing platform response metadata through, and merges heartbeat comments with `withHeartbeat`. A focused reader/cancel test validates response-level heartbeats without changing live-counter route ordering.","tradeoff":"The live counter example is not switched to default heartbeats because `Stream.tick` emits immediately and would change first-chunk ordering. Apps can opt in explicitly when that behavior is acceptable or after adding a delayed-heartbeat variant.","next_action_hint":"Consider adding a delayed heartbeat helper (sleep before first tick) if examples should use keepalives without an immediate comment frame, or continue replacing manual async generator tests with Stream constructors."}}
{"run":89,"commit":"f23b313","metric":0,"metrics":{"tests":127,"ts_files":37},"status":"crash","description":"Delayed heartbeat attempt still changed live-counter in-memory shutdown behavior","timestamp":1779068304548,"segment":0,"confidence":8.232558139534884,"asi":{"hypothesis":"Adding `initialDelay` to heartbeat options should let the live counter use keepalives without a leading heartbeat frame before the first patch.","error_details":"The focused delayed heartbeat idea was fine, but enabling heartbeat on the live counter still made the in-memory `liveResponse.text()` test receive an empty body after publish+shutdown. Merging a delayed heartbeat stream with a PubSub stream appears to change shutdown/termination races at the HttpServerResponse.toWeb boundary.","rollback_reason":"Test failure; autoresearch crash rollback required.","next_action_hint":"Keep response-level heartbeat opt-in only. If adding initialDelay, do not enable it in live-counter in the same iteration; test delayed heartbeat with a finite stream first, then separately investigate PubSub shutdown + merged delayed heartbeat semantics."}}
{"run":90,"commit":"e0fe4e4","metric":127,"metrics":{"tests":127,"ts_files":37},"status":"keep","description":"Support delayed first heartbeat for opt-in SSE keepalives","timestamp":1779068367746,"segment":0,"confidence":8.428571428571429,"asi":{"hypothesis":"Heartbeat options should support delaying the first keepalive so finite or immediately-updating SSE streams do not receive an unwanted leading comment frame.","learned":"`HeartbeatOptions.initialDelay` composes `Effect.sleep` with `Stream.tick`, preserving the previous immediate heartbeat behavior when omitted while allowing delayed keepalives for streams where first-event ordering matters. The focused test verifies a finite event stream completes without a leading heartbeat when initialDelay is longer than the stream lifetime.","tradeoff":"The live counter still does not enable heartbeat by default because PubSub shutdown plus merged heartbeat needs separate investigation at the response-body boundary. The helper is ready for apps that explicitly choose the behavior.","next_action_hint":"Investigate PubSub shutdown + heartbeat-merged streams separately, or continue replacing manual async generator streaming fixtures with `Stream.make`/`Stream.fromEffect` constructors."}}
{"run":91,"commit":"531bb6f","metric":128,"metrics":{"tests":128,"ts_files":37},"status":"keep","description":"Validate platform SSE streaming with Effect Stream constructors","timestamp":1779068463513,"segment":0,"confidence":8.634146341463415,"asi":{"hypothesis":"Remaining platform streaming fixtures should use Effect Stream constructors instead of manual async generators, matching the new Stream-first realtime/platform direction and preventing regressions in native Stream SSE responses.","learned":"`platformEventStreamResponse` streams `Stream.make` sources directly through native Effect Platform responses with status/header metadata preserved, and the platform routing streaming test now composes delayed second chunks with `Stream.concat`/`Stream.fromEffect` instead of an ad-hoc async generator.","tradeoff":"This iteration mostly hardens and documents existing Stream support through tests rather than adding a new public API. It is still valuable because direct Effect Stream sources are now the preferred path after the PubSub refactor.","next_action_hint":"Next promising feature: add a tiny stream collection/response assertion utility if tests keep duplicating Web reader plumbing, or investigate PubSub shutdown + heartbeat-merged streams now that basic Stream-first fixtures are stable."}}
{"run":92,"commit":"407a7d9","metric":129,"metrics":{"tests":129,"ts_files":38},"status":"keep","description":"Add package scripts for checking examples","timestamp":1779068552017,"segment":0,"confidence":8.85,"asi":{"hypothesis":"Focused package scripts will make the example suite easy to run manually without remembering individual vitest file names, improving day-to-day validation of the prototype examples.","learned":"Added `check:examples` for typecheck plus focused example tests, `test:examples` for the example test group, individual `test:example:*` scripts for counter/search/live/TSX examples, and a general `check` script. A package-script regression test ensures the example check command continues to cover all current example test files.","user_request":"Add package.json scripts to easily check examples.","tradeoff":"The scripts are explicit file lists rather than broad globs so they are predictable in pnpm/sh across environments. New example files should update `test:examples` and the regression test.","next_action_hint":"Next iteration can add README usage notes for these scripts or consider runnable dev-server scripts for examples if manual browser checking becomes important."}}
{"run":93,"commit":"7346187","metric":130,"metrics":{"tests":130,"ts_files":38},"status":"keep","description":"Document and add per-example check scripts","timestamp":1779068649157,"segment":0,"confidence":9.31578947368421,"asi":{"hypothesis":"After adding example test scripts, per-example `check:*` scripts plus README usage notes will make the examples easier to validate without remembering whether typecheck is included.","learned":"Added individual `check:example:*` scripts that run typecheck before each focused example test, and documented the all-example and per-example commands in README. The package-scripts regression now checks both the scripts and their README documentation so user-facing validation commands stay discoverable.","tradeoff":"These scripts duplicate the typecheck step for focused checks, which is slower than plain `test:example:*` but safer for example validation. The plain `test:*` scripts remain available for fast Vitest-only runs.","next_action_hint":"Next promising iteration: consider a tiny `examples/README.md` that describes what each example proves, or add a lightweight runnable example server script if browser dogfooding becomes a priority."}}
{"run":94,"commit":"2c54735","metric":132,"metrics":{"tests":132,"ts_files":39},"status":"keep","description":"Add dev server scripts for runnable examples","timestamp":1779068792724,"segment":0,"confidence":9.31578947368421,"asi":{"hypothesis":"Example validation should include easy browser/server dogfooding scripts, not only test scripts, so users can run each example through the same Effect Platform Node HTTP path used by tests.","learned":"Added a shared `examples/dev-server.ts` that maps example names to their Effect Platform apps, starts a Node HTTP server via `NodeHttpServer.makeHandler`, supports HOST/PORT, and cleans up server scope/live-counter resources. Package scripts `dev:counter`, `dev:tsx-counter`, `dev:search`, and `dev:live-counter` build then run the chosen example. Tests verify the runnable example list and that the dev server serves the counter page on an ephemeral port.","user_request":"Add dev server scripts to package.json for easy example usage.","tradeoff":"Scripts run `build` before starting instead of using a watch-mode TS runner, avoiding a new dev dependency. This is simpler and reliable, but not hot-reloading. A future iteration can add watch mode if needed.","next_action_hint":"If dev workflow needs faster iteration, consider adding an optional `dev:watch:*` path with a TS runner or `tsc -w` + node restart. Also consider serving `/datastar.js` in dev examples if browser interactions need the actual client asset."}}
{"run":95,"commit":"2c54735","metric":0,"metrics":{"tests":264,"ts_files":39},"status":"crash","description":"First CDN dev-example attempt exposed stale dist tests in Vitest","timestamp":1779069133005,"segment":0,"confidence":9.31578947368421,"asi":{"hypothesis":"Use the existing Datastar CDN constant in example pages so dev-server scripts do not request a missing local /datastar.js asset.","error_details":"autoresearch failed because a previous `pnpm run build` left dist/test/*.js files and Vitest discovered both source tests and built tests. The built package-scripts test looked for dist/package.json/README.md and failed. This is an actual harness/config issue exposed by dev scripts creating dist, not a CDN logic failure.","rollback_reason":"Test run failed before the CDN change could be kept; autoresearch crash rollback required.","next_action_hint":"First exclude dist from Vitest or clean dist before tests so dev-server builds do not poison subsequent test discovery. Then reapply the CDN scriptSrc change for examples/dev pages and update example tests."}}
{"run":96,"commit":"5fcacdc","metric":132,"metrics":{"tests":132,"ts_files":39},"status":"keep","description":"Exclude built dist files from Vitest discovery","timestamp":1779069177011,"segment":0,"confidence":9.833333333333334,"asi":{"hypothesis":"Because the new dev-server scripts run `pnpm run build`, Vitest must ignore emitted `dist/**` files so a local build cannot make tests run twice or fail against relocated fixture paths.","learned":"Adding `test.exclude: ['dist/**', 'node_modules/**']` keeps the test suite stable even when `dist` exists from running dev scripts. The score remains at 132 with the expected 30 source test files rather than accidentally discovering built JS tests.","tradeoff":"This is harness hardening rather than user-visible behavior, but it is necessary before dev-server workflows are reliable.","next_action_hint":"Reapply the CDN scriptSrc change for example pages now that build artifacts no longer poison test discovery."}}
{"run":97,"commit":"8c8355f","metric":132,"metrics":{"tests":132,"ts_files":39},"status":"keep","description":"Use Datastar CDN in runnable example pages","timestamp":1779069312654,"segment":0,"confidence":9.833333333333334,"asi":{"hypothesis":"Dev-server examples should load Datastar from the existing CDN constant so browser dogfooding does not request a missing local /datastar.js asset.","learned":"Updated counter, TSX counter, search, and live-counter example pages to pass `scriptSrc: DATASTAR_CDN` to Datastar document/page helpers. Example and dev-server tests now assert the CDN script tag and ensure dev pages no longer emit `src=\"/datastar.js\"`. The earlier stale-dist Vitest issue was fixed first, so local builds no longer poison tests.","user_request":"The dev server returned 404 for /datastar.js; user asked to just use CDN.","tradeoff":"Library defaults still prefer explicit self-hosting via `/datastar.js`; only examples/dev pages use the CDN for convenience. Production apps can still choose self-hosted client routes.","next_action_hint":"Consider adding an environment/config option to dev-server for CDN vs self-hosted if offline development becomes important."}}
