{"run":68,"commit":"a280c56","metric":0,"metrics":{"tests":156,"ts_files":48},"status":"crash","description":"No-any route/node typing attempt failed because unknown constraints lost router inference","timestamp":1779063177713,"segment":0,"confidence":5.672727272727273,"asi":{"hypothesis":"Remove public/internal any from route/node helper types and stop Node runtime helpers from erasing unprovided Effect context.","error_details":"Replacing Route<any, any> constraints with Route<unknown, unknown> caused router implementation to infer Effect<Response, unknown, unknown> and break the precise conditional return type. The test helper listen(app: ReturnType<typeof router>) also widened app context to unknown, conflicting with Node helpers requiring R=never.","rollback_reason":"Typecheck failure; reverted per autoresearch rules.","next_action_hint":"Reapply in two smaller steps: first make Node runtime helpers require Handler<unknown, never> and fix tests with a better App type; leave route generic constraints alone or use a dedicated SomeRoute helper preserving inference without unknown widening."}}
{"run":69,"commit":"a280c56","metric":156,"metrics":{"tests":156,"ts_files":48},"status":"discard","description":"Constrain Node runtime helpers to environment-free handlers without adding a scored runtime test","timestamp":1779063296009,"segment":0,"confidence":5.777777777777778,"asi":{"hypothesis":"Narrow the user-requested Effect-foundation fix to the runtime boundary: Node helpers should require Handler<unknown, never> and stop casting away unprovided Effect context.","learned":"The change typechecked and compile-time assertions could catch environment erasure, but the primary metric stayed unchanged because the new checks lived in an existing compile-time-only test block and did not add a scored runtime case.","rollback_reason":"Primary metric was unchanged; autoresearch rules discard equal primary metrics even for code-quality improvements.","next_action_hint":"Reapply the Node Handler<unknown, never> constraint with a small scored runtime test that asserts createNodeListener still serves environment-free handlers, and keep compile-time @ts-expect-error coverage for unprovided environments."}}
{"run":70,"commit":"6a0377f","metric":157,"metrics":{"tests":157,"ts_files":48},"status":"keep","description":"Stop Node helpers from erasing unprovided Effect context","timestamp":1779063400908,"segment":0,"confidence":5.9245283018867925,"asi":{"hypothesis":"The most important immediate Effect-foundation fix is at the runtime boundary: Node helpers should only run handlers whose Effect context is already provided, instead of accepting any R and casting it to never.","learned":"createNodeListener, serve, and serveScoped now require Handler<unknown, never>; the unsafe cast in createNodeListener is gone. Compile-time coverage rejects handlers with unprovided context, while a real serve() regression verifies environment-free handlers still run without casts.","tradeoff":"Route composition still contains any-based constraints because a broad unknown replacement broke router inference. That should be revisited separately or replaced by Effect Platform HTTP primitives rather than forcing a brittle type trick.","next_action_hint":"Next investigate @effect/platform / @effect/platform-node HttpServer as the real replacement for the hand-rolled node:http adapter, ideally by adding dependencies and a small adapter or example rather than expanding raw Node plumbing."}}
{"run":71,"commit":"7093a7f","metric":158,"metrics":{"tests":158,"ts_files":50},"status":"keep","description":"Add Effect Platform HTTP adapter for ts-star handlers","timestamp":1779063589572,"segment":0,"confidence":5.851851851851852,"asi":{"hypothesis":"The prototype should not be locked to hand-rolled node:http plumbing; adding an adapter to @effect/platform HTTP apps lets ts-star handlers run under Effect's NodeHttpServer while preserving the Web Request/Response handler shape for now.","learned":"toPlatformApp converts the provided HttpServerRequest service to a Web Request with HttpServerRequest.toWeb, runs a ts-star Handler, then converts the Web Response back with HttpServerResponse.fromWeb. A real NodeHttpServer.makeHandler + node:http server test proves the adapter dispatches through Effect Platform.","tradeoff":"This is an adapter, not a full rewrite to HttpRouter/HttpApi yet. It keeps existing examples working while opening a migration path to Effect Platform. The raw node.ts adapter still exists and should be treated as compatibility/prototype plumbing, not the foundation.","next_action_hint":"Next replace or mirror the exact-route router on top of @effect/platform HttpRouter, or add tests for Effect Platform SSE/direct Datastar responses to ensure streaming semantics survive the adapter."}}
{"run":72,"commit":"8e2e66d","metric":160,"metrics":{"tests":160,"ts_files":50},"status":"keep","description":"Convert exact ts-star routes to Effect Platform HttpRouter","timestamp":1779063737978,"segment":0,"confidence":6.153846153846154,"asi":{"hypothesis":"To make the foundation more idiomatic Effect, exact ts-star routes should be convertible to @effect/platform HttpRouter rather than only wrapped as one Web-style app.","learned":"toPlatformRoute maps a ts-star exact Route to HttpRouter.makeRoute via toPlatformApp, and toPlatformRouter builds an Effect Platform HttpRouter from route values. A NodeHttpServer.makeHandler test verifies GET, POST, and platform 404 behavior; invalid non-absolute paths fail early with PlatformPathError.","tradeoff":"The conversion still bridges through Web Request/Response for handler compatibility, and contains a narrow type assertion around HttpRouter.fromIterable inference. It is a migration path toward Effect Platform routing, not a complete rewrite of the app API yet.","next_action_hint":"Next validate Datastar SSE streaming through the Effect Platform adapter/router, or replace the remaining custom exact router internals with HttpRouter while preserving the simple public Route API."}}
{"run":73,"commit":"01fd8b8","metric":161,"metrics":{"tests":161,"ts_files":50},"status":"keep","description":"Verify Datastar SSE streaming through Effect Platform router","timestamp":1779063826043,"segment":0,"confidence":6.1923076923076925,"asi":{"hypothesis":"The Effect Platform adapter/router migration path must preserve Datastar long-lived SSE semantics, not just plain request/response behavior.","learned":"A toPlatformRouter route returning eventStreamResponse streams through NodeHttpServer.makeHandler with text/event-stream headers and delivers chunks before the body closes. This gives confidence that HttpServerResponse.fromWeb keeps Web Response streams viable for Datastar SSE over Effect Platform.","tradeoff":"This is still a bridge through Web Response rather than native HttpServerResponse constructors. The test validates the bridge while leaving a future refactor toward native platform responses open.","next_action_hint":"Next explore native @effect/platform response constructors for Datastar SSE/direct responses, or add a typed PlatformHandler surface that returns HttpServerResponse directly."}}
{"run":74,"commit":"3494f18","metric":165,"metrics":{"tests":165,"ts_files":51},"status":"keep","description":"Add native Effect Platform Datastar SSE response helpers","timestamp":1779063986980,"segment":0,"confidence":6.226415094339623,"asi":{"hypothesis":"New Effect-first code should be able to return native @effect/platform HttpServerResponse values for Datastar SSE instead of always bridging through Web Response.","learned":"platformSseResponse, platformEventStreamResponse, platformPatchSignalsResponse, and platformPatchElementsResponse build native HttpServerResponse values with SSE defaults and optional status/custom headers. NodeHttpServer tests verify raw SSE, Datastar signal patches, rendered HTML element patches, and async SSE streams all work without Web Response conversion.","tradeoff":"These helpers currently cover SSE/patch responses only; direct HTML/JSON/script native platform helpers can follow if needed. Existing Web Response helpers remain for compatibility while Effect Platform becomes the preferred foundation.","next_action_hint":"Next add native Effect Platform direct response helpers for HTML/JSON/script or start migrating examples/tests to platform-native routes to reduce reliance on the custom Web router."}}
{"run":75,"commit":"0ba8971","metric":169,"metrics":{"tests":169,"ts_files":52},"status":"keep","description":"Add native Effect Platform direct Datastar response helpers","timestamp":1779064113107,"segment":0,"confidence":5.827586206896552,"asi":{"hypothesis":"Effect-first handlers should be able to return native @effect/platform HttpServerResponse values for single-shot Datastar actions (HTML patches, JSON signal patches, scripts) instead of relying on Web Response helpers.","learned":"platformHtmlResponse, platformHtmlPatchResponse, platformJsonSignalsResponse, and platformScriptResponse cover native direct responses with status/header support, rendered HTML nodes, Datastar override headers, JSON signal headers, and script attribute headers. NodeHttpServer tests prove they serve correctly through HttpRouter.","tradeoff":"Some implementation still mirrors Web helper behavior; future cleanup can factor shared header/default logic or move examples to platform-native handlers. This completes the native platform response surface enough to reduce raw Web Response dependence.","next_action_hint":"Next migrate one example (counter or search) to an Effect Platform-native route/router variant using platform response helpers, showing the preferred future foundation while keeping Web examples for compatibility."}}
{"run":76,"commit":"dfabd5f","metric":174,"metrics":{"tests":174,"ts_files":53},"status":"keep","description":"Add Effect Platform-native counter example","timestamp":1779064253904,"segment":0,"confidence":6,"asi":{"hypothesis":"A platform-native counter example should demonstrate the preferred future foundation: Effect Platform HttpRouter/HttpServerResponse handlers using Datastar helpers, rather than building new framework design solely on Web Response wrappers.","learned":"examples/platform-counter.ts defines a native HttpRouter with a page route and increment action. The action reads HttpServerRequest.toWeb only at the signal-decoding boundary, returns native platformPatchSignalsResponse, and handles decode failures as a native 400 response. NodeHttpServer tests verify page rendering, good signal patches, bad signal errors, and route dispatch.","tradeoff":"Signal decoding still reuses the Web Request decoder, so the request layer is not fully platform-native yet. This is a deliberate incremental migration: native routing/responses first, then native signal decoding can follow.","next_action_hint":"Next add native Effect Platform signal decoding helpers using HttpServerRequest (query/body) to remove the remaining Web Request conversion inside platform-native actions."}}
{"run":77,"commit":"1546f56","metric":177,"metrics":{"tests":177,"ts_files":54},"status":"keep","description":"Add native Effect Platform Datastar signal decoding","timestamp":1779064434917,"segment":0,"confidence":5.709677419354839,"asi":{"hypothesis":"Effect Platform-native actions should decode Datastar signals directly from HttpServerRequest instead of converting back to Web Request, removing the last compatibility bridge inside platform-native handlers.","learned":"platformRawSignalsFromRequest/platformReadSignalsFromRequest/platformReadSignals read GET/DELETE datastar query payloads or non-GET request text directly from HttpServerRequest, then reuse the existing JSON parse and Effect Schema decode pipeline. The platform counter action no longer calls HttpServerRequest.toWeb; tests cover POST, GET query, and typed decode failures through NodeHttpServer.","tradeoff":"The decode logic is duplicated conceptually with the Web request helper; a future refactor could share a pure raw-payload decoder. This is acceptable because platform-native handlers now avoid Web Request conversion at runtime.","next_action_hint":"Next address remaining any/type-erasure in route composition with a smaller targeted approach, or migrate the custom exact router implementation to delegate to HttpRouter as the canonical runtime path."}}
{"run":78,"commit":"f116213","metric":111,"metrics":{"tests":111,"ts_files":36},"status":"keep","description":"Baseline current Effect v4 platform-native branch before docs-driven Stream/PubSub cleanup","timestamp":1779066746875,"segment":0,"confidence":6.103448275862069,"asi":{"hypothesis":"Establish the current post-Effect-v4, platform-native baseline before replacing any remaining manual streaming/pubsub primitives with Effect-native Stream/PubSub/Sink patterns from the local docs.","learned":"The current branch passes typecheck/tests with 111 prototype tests across 36 TS files. Earlier logged scores used a broader pre-cleanup workload, so this run acts as the current branch baseline for the docs-driven Effect-native pass.","next_action_hint":"Study Effect Stream/concurrency/sink docs, then target manual realtime/broadcaster helpers and async-iterator streaming paths for replacement with built-in Effect Stream/PubSub where it reduces custom plumbing."}}
{"run":79,"commit":"f116213","metric":0,"metrics":{"tests":120,"ts_files":36},"status":"crash","description":"First Effect PubSub realtime refactor failed typecheck on Effect.fork API/context inference","timestamp":1779067143163,"segment":0,"confidence":6.103448275862069,"asi":{"hypothesis":"Replace the manual Broadcaster/AsyncIterable realtime helper with Effect PubSub plus Stream.fromPubSub and Stream.map-based patching.","error_details":"Typecheck failed in realtime.test.ts: Effect.fork does not exist in Effect v4 beta API, and the attempted fork/join test inferred an unknown context for Effect.runPromise.","rollback_reason":"Typecheck failure before tests; autoresearch crash rollback required.","next_action_hint":"Reapply the PubSub refactor but use the v4 fiber API (`Effect.forkDaemon` or `Effect.forkScoped` if available) or avoid fibers in the broadcast test by using PubSub replay/current values. Keep the production code changes; the issue was test orchestration."}}
{"run":80,"commit":"0761531","metric":114,"metrics":{"tests":114,"ts_files":36},"status":"keep","description":"Replace manual realtime broadcaster with Effect PubSub and Stream.fromPubSub","timestamp":1779067296356,"segment":0,"confidence":6.103448275862069,"asi":{"hypothesis":"Effect already provides the right realtime primitives, so replacing the hand-rolled broadcaster/async-iterator queue with PubSub plus Stream.fromPubSub should reduce manual plumbing while preserving Datastar SSE behavior.","learned":"The local docs pointed directly to PubSub for broadcast fanout and Stream.fromPubSub for stream integration. The refactor removes custom subscription queues, maps live updates with Stream.map, keeps async iterables only at the outer response boundary for compatibility, and uses PubSub replay in the live counter to avoid subscribe-before-publish races.","docs_checked":["website/content/src/content/docs/docs/concurrency/pubsub.mdx","website/content/src/content/docs/docs/concurrency/queue.mdx","website/content/src/content/docs/docs/stream/creating.mdx","website/content/src/content/docs/docs/stream/consuming-streams.mdx","website/content/src/content/docs/docs/stream/resourceful-streams.mdx","website/content/src/content/docs/docs/sink/introduction.mdx","website/content/src/content/docs/docs/sink/creating.mdx"],"tradeoff":"A small makeBroadcaster alias remains for compatibility, but it now returns an Effect PubSub instead of a custom class. Sink docs were useful for test consumption patterns but did not need production API changes in this slice.","next_action_hint":"Continue scanning for remaining manual stream/Effect integration. The next likely improvement is to make `platformEventStreamResponse` fully Effect-Stream-first in docs/examples, or add a scoped layer/resource constructor for realtime topics instead of calling Effect.runSync in createLiveCounter."}}
{"run":81,"commit":"2384bb6","metric":118,"metrics":{"tests":118,"ts_files":37},"status":"keep","description":"Add a runnable TSX counter example alongside hyperscript examples","timestamp":1779067490761,"segment":0,"confidence":6.679245283018868,"asi":{"hypothesis":"A TSX example will prove the existing JSX factory is practical for real Datastar/Effect Platform app code, not just isolated renderer tests.","learned":"`examples/tsx-counter.tsx` can use the same Datastar attribute helpers, Effect Schema signal decoding, native platform responses, and platform router as the hyperscript counter. TypeScript needed `examples/**/*.tsx` in tsconfig so the example is typechecked with the project.","user_request":"Add an example using TSX because current examples use hyperscript.","tradeoff":"This stays a thin TSX factory over the existing HTML node model; it does not introduce component semantics or a client framework.","next_action_hint":"Continue improving TSX ergonomics only where examples reveal friction. A possible next step is explicit support/tests for simple function components if desired, but avoid React-like scope creep unless it materially improves server-side Datastar views."}}
{"run":82,"commit":"227cc5b","metric":120,"metrics":{"tests":120,"ts_files":37},"status":"keep","description":"Support typed server components in the TSX factory and example","timestamp":1779067645646,"segment":0,"confidence":7.08,"asi":{"hypothesis":"A real TSX example becomes more useful if it can factor reusable typed server-side components instead of only using intrinsic tags.","learned":"The JSX factory can support minimal function components by passing cleaned props plus a single/array children prop, while keeping intrinsic elements rendered through the existing HTML node model. The TSX counter now uses a reusable typed CounterButton component without adding React-like runtime machinery.","tradeoff":"Component support is intentionally server-only and small: no hooks, lifecycle, or client framework semantics. A local cast is used at the factory boundary because TypeScript JSX needs generic component props while runtime dispatch only sees a function tag.","next_action_hint":"Next TSX ergonomics issue to investigate is whether attributes should use `class` only or also accept `className` as a server-side convenience; avoid adding React compatibility unless examples clearly benefit."}}
{"run":83,"commit":"c402486","metric":121,"metrics":{"tests":121,"ts_files":37},"status":"keep","description":"Add scoped realtime PubSub construction with automatic shutdown","timestamp":1779067719055,"segment":0,"confidence":7.224489795918367,"asi":{"hypothesis":"Effect's scoped resource pattern should manage realtime PubSub lifecycle directly instead of requiring every app/test to remember manual shutdown.","learned":"`makeRealtimePubSubScoped` composes the existing PubSub constructor with `Effect.addFinalizer` so closing the surrounding scope shuts down the PubSub. This follows the resourceful-stream/concurrency docs and gives apps a safer option for long-lived topics.","tradeoff":"The non-scoped constructor remains for examples/tests that intentionally own shutdown manually. The scoped helper is additive and keeps the PubSub/Stream foundation intact.","next_action_hint":"Consider updating live examples to use scoped construction when served by an Effect-managed runtime, or add a small test showing PubSub shutdown terminates stream readers without explicit shutdown calls."}}
{"run":84,"commit":"0b6a6e6","metric":122,"metrics":{"tests":122,"ts_files":37},"status":"keep","description":"Expose a scoped live counter constructor using scoped realtime PubSub","timestamp":1779067795363,"segment":0,"confidence":7.375,"asi":{"hypothesis":"The live counter example should model Effect-managed resource lifecycles by offering a scoped constructor that uses the scoped realtime PubSub helper rather than only a manually shutdown variant.","learned":"`makeLiveCounterScoped` reuses the same live counter assembly with `makeRealtimePubSubScoped`, so closing the surrounding Effect scope shuts down the PubSub. Tests verify the example-level scoped constructor releases its PubSub automatically.","tradeoff":"The existing `createLiveCounter`/`makeLiveCounter` helpers stay non-scoped for simple tests and demos that manually call `shutdown`, while Effect-managed runtimes can choose the scoped constructor.","next_action_hint":"Next promising cleanup: remove manual async generator test fixtures from platform streaming tests by using Effect Streams directly, and add Stream-based interval/live response examples if useful."}}
{"run":85,"commit":"37f5de2","metric":123,"metrics":{"tests":123,"ts_files":37},"status":"keep","description":"Normalize className in TSX examples to HTML class attributes","timestamp":1779067886504,"segment":0,"confidence":7.695652173913044,"asi":{"hypothesis":"After adding a TSX example, a small JSX factory normalization for `className` should remove a common TSX/server-rendering footgun while still emitting standard HTML.","learned":"The JSX factory can normalize intrinsic `className` to `class` without changing the underlying HTML node model. The TSX counter now demonstrates `className` in example code while rendering a correct `class` attribute.","tradeoff":"Only `className` is normalized for now. Broader React compatibility such as `htmlFor` is intentionally deferred until an example needs it.","next_action_hint":"Continue docs-driven cleanup by replacing remaining async-generator streaming examples/tests with Effect `Stream` constructors, or explore an Effect Stream/Sink test utility for collecting SSE responses."}}
